s,h,s,h,s
SAGE Video Counseling & Psychotherapy Collection,https://login.proxy.library.ohio.gov/login?url=https://sk.sagepub.com/search/results/8475,Health & Medicine,"This database videos on counseling and psychotherapy topics, including techniques and therapeutic approaches.",
Sanborn Insurance Maps,https://login.proxy.library.ohio.gov/login?url=https://sanborn.ohioweblibrary.org/,History,"Historical maps of u.s. cities and towns, including information on buildings and streets.",
Science Reference Center,https://login.proxy.library.ohio.gov/login?url=https://search.ebscohost.com/login.aspx?profile=scirc&amp;defaultdb=sch&amp;authtype=ip&amp;custid=daryl,Science & Technology,"Full-text articles and science experiments on a wide range of scientific topics, including biology, chemistry, and physics.",
Small Business Reference Center,"https://login.proxy.library.ohio.gov/login?url=https://search.ebscohost.com/login.aspx?authtype=ip,uid&amp;profile=ehost&amp;groupid=main&amp;defaultdb=b9h&amp;authtype=ip&amp;custid=daryl ",Business & Economics,"This database resources for starting and running a small business, including sample business plans, industry information, and more.",
SocINDEX,https://login.proxy.library.ohio.gov/login?url=https://search.ebscohost.com/login.aspx?profile=ehost&amp;groupid=main&amp;defaultdb=sih&amp;authtype=ip&amp;custid=daryl,"Social Sciences, Sociology","Articles on sociology and related fields, including criminology, demography, and ethnic studies.",
Sociological Collection,https://login.proxy.library.ohio.gov/login?url=https://search.ebscohost.com/login.aspx?profile=ehost&amp;groupid=main&amp;defaultdb=slh&amp;authtype=ip&amp;custid=daryl,"Social Sciences, Sociology","Articles on sociology and related fields, including social work, human services, and criminal justice.",
SPORTDiscus,https://login.proxy.library.ohio.gov/login?url=https://search.ebscohost.com/login.aspx?profile=ehost&amp;groupid=main&amp;defaultdb=s3h&amp;authtype=ip&amp;custid=daryl,"Sports, Health & Medicine","Articles on sports medicine, exercise science, kinesiology, and more.",
Stanford Encyclopedia of Philosophy,https://plato.stanford.edu/contents.html,Literature & Humanities,"Scholarly articles on philosophical topics, including ethics, metaphysics, and epistemology.",
Statistical Abstract of the United States,https://login.proxy.library.ohio.gov/login?url=https://www.proquest.com/statistical?landingpage=statab,Business & Economics,"Statistics on the social, political, and economic conditions of the united states.",
Vente et Gestion,https://login.proxy.library.ohio.gov/login?url=https://search.ebscohost.com/login.aspx?profile=ehost&amp;groupid=main&amp;defaultdb=frh&amp;authtype=ip&amp;custid=daryl,Business & Economics,"Articles on sales and marketing, business strategy, and related topics in french.",
Vocational and Career Collection,https://login.proxy.library.ohio.gov/login?url=https://search.ebscohost.com/login.aspx?profile=ehost&amp;groupid=main&amp;defaultdb=voh&amp;authtype=ip&amp;custid=daryl,"Education, Business & Economics","Articles on vocational education, job searching, and related topics.",
Web of Science,https://login.proxy.library.ohio.gov/login?url=https://www.webofscience.com/wos/woscc/basic-search,"Science & Technology, General Research","Scholarly research in the sciences, social sciences, arts, and humanities.",
Women's Studies International,https://login.proxy.library.ohio.gov/login?url=https://search.ebscohost.com/login.aspx?profile=ehost&amp;groupid=main&amp;defaultdb=fyh&amp;authtype=ip&amp;custid=daryl,Social Sciences,"Articles on women's studies, including gender issues, sexuality, and feminism.",
World Book Online,https://login.proxy.library.ohio.gov/login?url=https://www.worldbookonline.com/?subacct=17820,"Education, Literature & Humanities","Encyclopedias, dictionaries, and other reference materials for students.",
WorldCat,https://www.worldcat.org,General Research,The collections of thousands of libraries worldwide.,
WorldCat Dissertations and Theses,https://login.proxy.library.ohio.gov/login?url=https://firstsearch.oclc.org/dbname=worldcatdissertations;done=referer;fsip,General Research,Dissertations and theses from around the world.,
Wright Brothers Collection,https://login.proxy.library.ohio.gov/login?url=https://corescholar.libraries.wright.edu/special_ms1/,"Science & Technology, History","Documents, photographs, and other materials related to the wright brothers and the history of aviation.",